{
  "contract": "noesis-capability-provider-v1",
  "provider_id": "noesis.cultural",
  "version": "1.0.0",
  "description": "Generated by src/composition/bundles.py from the verified capability map; owns src.kb.cultural records.",
  "implementation": {
    "identity": "src.kb.cultural",
    "version": "1.0.0"
  },
  "capabilities": [
    {
      "capability": "cultural.cultural-primary-source-records",
      "version": "1.0.0",
      "input_contract": {
        "name": "noesis-mcp-tool-io-v1",
        "version": "1.0.0"
      },
      "output_contract": {
        "name": "noesis-mcp-tool-io-v1",
        "version": "1.0.0"
      },
      "semantics": {
        "io": "catalog-declared-tool-schemas",
        "declared_as": "cultural-primary-source-records"
      },
      "effect": "read-only",
      "idempotent": true,
      "execution_receipt": false,
      "required_scopes": [
        "knowledge:cultural:read"
      ],
      "required_context": [
        "namespace",
        "principal"
      ],
      "record_kinds": [],
      "bindings": [
        {
          "kind": "mcp-tool",
          "id": "noesis-knowledge-engine.cultural_readiness"
        },
        {
          "kind": "mcp-tool",
          "id": "noesis-knowledge-engine.cultural_source_contracts"
        },
        {
          "kind": "mcp-tool",
          "id": "noesis-knowledge-engine.inspect_cultural_object"
        },
        {
          "kind": "mcp-tool",
          "id": "noesis-knowledge-engine.search_cultural_objects"
        }
      ],
      "readiness": {
        "probe": "catalog.required-data",
        "required_data": [
          "knowledge-engine-runtime"
        ]
      }
    },
    {
      "capability": "cultural.cultural-primary-source-records-changes",
      "version": "1.0.0",
      "input_contract": {
        "name": "noesis-mcp-tool-io-v1",
        "version": "1.0.0"
      },
      "output_contract": {
        "name": "noesis-mcp-tool-io-v1",
        "version": "1.0.0"
      },
      "semantics": {
        "io": "catalog-declared-tool-schemas",
        "declared_as": "cultural-primary-source-records"
      },
      "effect": "local-mutation",
      "idempotent": false,
      "execution_receipt": false,
      "required_scopes": [
        "knowledge:cultural:review",
        "knowledge:cultural:write"
      ],
      "required_context": [
        "namespace",
        "principal"
      ],
      "record_kinds": [],
      "bindings": [
        {
          "kind": "mcp-tool",
          "id": "noesis-knowledge-engine.propose_cultural_matches"
        },
        {
          "kind": "mcp-tool",
          "id": "noesis-knowledge-engine.review_cultural_match"
        }
      ],
      "readiness": {
        "probe": "catalog.required-data",
        "required_data": [
          "knowledge-engine-runtime"
        ]
      }
    },
    {
      "capability": "cultural.rights-gated-cultural-assets",
      "version": "1.0.0",
      "input_contract": {
        "name": "noesis-mcp-tool-io-v1",
        "version": "1.0.0"
      },
      "output_contract": {
        "name": "noesis-mcp-tool-io-v1",
        "version": "1.0.0"
      },
      "semantics": {
        "io": "catalog-declared-tool-schemas",
        "declared_as": "rights-gated-cultural-assets"
      },
      "effect": "read-only",
      "idempotent": true,
      "execution_receipt": false,
      "required_scopes": [],
      "required_context": [
        "namespace",
        "principal"
      ],
      "record_kinds": [],
      "bindings": [
        {
          "kind": "mcp-tool",
          "id": "noesis-knowledge-engine.cultural_rights_policy"
        }
      ],
      "readiness": {
        "probe": "catalog.required-data",
        "required_data": [
          "knowledge-engine-runtime"
        ]
      }
    },
    {
      "capability": "cultural.rights-gated-cultural-assets-acquisition",
      "version": "1.0.0",
      "input_contract": {
        "name": "noesis-mcp-tool-io-v1",
        "version": "1.0.0"
      },
      "output_contract": {
        "name": "noesis-mcp-tool-io-v1",
        "version": "1.0.0"
      },
      "semantics": {
        "io": "catalog-declared-tool-schemas",
        "declared_as": "rights-gated-cultural-assets"
      },
      "effect": "acquisition",
      "idempotent": false,
      "execution_receipt": false,
      "required_scopes": [
        "knowledge:cultural:write"
      ],
      "required_context": [
        "namespace",
        "principal"
      ],
      "record_kinds": [],
      "bindings": [
        {
          "kind": "mcp-tool",
          "id": "noesis-knowledge-engine.acquire_cultural_assets"
        }
      ],
      "readiness": {
        "probe": "catalog.required-data",
        "required_data": [
          "knowledge-engine-runtime"
        ]
      }
    },
    {
      "capability": "cultural.primary-source-research-links",
      "version": "1.0.0",
      "input_contract": {
        "name": "noesis-mcp-tool-io-v1",
        "version": "1.0.0"
      },
      "output_contract": {
        "name": "noesis-mcp-tool-io-v1",
        "version": "1.0.0"
      },
      "semantics": {
        "io": "catalog-declared-tool-schemas",
        "declared_as": "primary-source-research-links"
      },
      "effect": "read-only",
      "idempotent": true,
      "execution_receipt": false,
      "required_scopes": [
        "knowledge:cultural:read"
      ],
      "required_context": [
        "namespace",
        "principal"
      ],
      "record_kinds": [],
      "bindings": [
        {
          "kind": "mcp-tool",
          "id": "noesis-knowledge-engine.primary_sources_for_work"
        }
      ],
      "readiness": {
        "probe": "catalog.required-data",
        "required_data": [
          "knowledge-engine-runtime"
        ]
      }
    },
    {
      "capability": "cultural.primary-source-research-links-changes",
      "version": "1.0.0",
      "input_contract": {
        "name": "noesis-mcp-tool-io-v1",
        "version": "1.0.0"
      },
      "output_contract": {
        "name": "noesis-mcp-tool-io-v1",
        "version": "1.0.0"
      },
      "semantics": {
        "io": "catalog-declared-tool-schemas",
        "declared_as": "primary-source-research-links"
      },
      "effect": "local-mutation",
      "idempotent": false,
      "execution_receipt": false,
      "required_scopes": [
        "knowledge:cultural:review",
        "knowledge:cultural:write"
      ],
      "required_context": [
        "namespace",
        "principal"
      ],
      "record_kinds": [],
      "bindings": [
        {
          "kind": "mcp-tool",
          "id": "noesis-knowledge-engine.link_cultural_research"
        },
        {
          "kind": "mcp-tool",
          "id": "noesis-knowledge-engine.review_cultural_research_candidate"
        },
        {
          "kind": "mcp-tool",
          "id": "noesis-knowledge-engine.suggest_cultural_research_candidates"
        }
      ],
      "readiness": {
        "probe": "catalog.required-data",
        "required_data": [
          "knowledge-engine-runtime"
        ]
      }
    },
    {
      "capability": "cultural.cultural-object-place-projection",
      "version": "1.0.0",
      "input_contract": {
        "name": "noesis-mcp-tool-io-v1",
        "version": "1.0.0"
      },
      "output_contract": {
        "name": "noesis-mcp-tool-io-v1",
        "version": "1.0.0"
      },
      "semantics": {
        "io": "catalog-declared-tool-schemas",
        "declared_as": "cultural-object-place-projection"
      },
      "effect": "read-only",
      "idempotent": true,
      "execution_receipt": false,
      "required_scopes": [
        "knowledge:cultural:read"
      ],
      "required_context": [
        "namespace",
        "principal"
      ],
      "record_kinds": [],
      "bindings": [
        {
          "kind": "mcp-tool",
          "id": "noesis-knowledge-engine.inspect_cultural_object"
        },
        {
          "kind": "mcp-tool",
          "id": "noesis-knowledge-engine.search_cultural_objects"
        }
      ],
      "readiness": {
        "probe": "catalog.required-data",
        "required_data": [
          "knowledge-engine-runtime"
        ]
      }
    }
  ],
  "stores": [
    {
      "record_kind": "cultural_object",
      "tables": [
        "cultural_assets",
        "cultural_current",
        "cultural_match_reviews",
        "cultural_matches",
        "cultural_objects",
        "cultural_places",
        "cultural_research_links",
        "cultural_revisions"
      ],
      "revision_addressing": "immutable"
    }
  ],
  "source_packs": [
    {
      "pack_id": "primary-scientific-evidence",
      "range": "^1.0.0",
      "config": "config/source_packs/scientific.json"
    }
  ]
}
