{
  "contract": "noesis-capability-provider-v1",
  "provider_id": "noesis.products",
  "version": "1.0.0",
  "description": "Generated by src/composition/bundles.py from the verified capability map; owns src.kb.products records.",
  "implementation": {
    "identity": "src.kb.products",
    "version": "1.0.0"
  },
  "capabilities": [
    {
      "capability": "products.evidence-linked-model-comparison",
      "version": "1.0.0",
      "input_contract": {
        "name": "noesis-mcp-tool-io-v1",
        "version": "1.0.0"
      },
      "output_contract": {
        "name": "noesis-mcp-tool-io-v1",
        "version": "1.0.0"
      },
      "semantics": {
        "io": "catalog-declared-tool-schemas",
        "declared_as": "evidence-linked-model-comparison"
      },
      "effect": "read-only",
      "idempotent": true,
      "execution_receipt": false,
      "required_scopes": [
        "knowledge:products:read"
      ],
      "required_context": [
        "namespace",
        "principal"
      ],
      "record_kinds": [],
      "bindings": [
        {
          "kind": "mcp-tool",
          "id": "noesis-knowledge-engine.compare_product_models"
        }
      ],
      "readiness": {
        "probe": "catalog.required-data",
        "required_data": [
          "knowledge-engine-runtime"
        ]
      }
    },
    {
      "capability": "products.per-provider-readiness",
      "version": "1.0.0",
      "input_contract": {
        "name": "noesis-mcp-tool-io-v1",
        "version": "1.0.0"
      },
      "output_contract": {
        "name": "noesis-mcp-tool-io-v1",
        "version": "1.0.0"
      },
      "semantics": {
        "io": "catalog-declared-tool-schemas",
        "declared_as": "per-provider-readiness"
      },
      "effect": "read-only",
      "idempotent": true,
      "execution_receipt": false,
      "required_scopes": [
        "knowledge:products:read"
      ],
      "required_context": [
        "namespace",
        "principal"
      ],
      "record_kinds": [],
      "bindings": [
        {
          "kind": "mcp-tool",
          "id": "noesis-knowledge-engine.product_provider_contracts"
        },
        {
          "kind": "mcp-tool",
          "id": "noesis-knowledge-engine.products_readiness"
        }
      ],
      "readiness": {
        "probe": "catalog.required-data",
        "required_data": [
          "knowledge-engine-runtime"
        ]
      }
    },
    {
      "capability": "products.provider-linked-document-acquisition",
      "version": "1.0.0",
      "input_contract": {
        "name": "noesis-mcp-tool-io-v1",
        "version": "1.0.0"
      },
      "output_contract": {
        "name": "noesis-mcp-tool-io-v1",
        "version": "1.0.0"
      },
      "semantics": {
        "io": "catalog-declared-tool-schemas",
        "declared_as": "provider-linked-document-acquisition"
      },
      "effect": "read-only",
      "idempotent": true,
      "execution_receipt": false,
      "required_scopes": [
        "knowledge:products:read"
      ],
      "required_context": [
        "namespace",
        "principal"
      ],
      "record_kinds": [],
      "bindings": [
        {
          "kind": "mcp-tool",
          "id": "noesis-knowledge-engine.inspect_product_identity"
        }
      ],
      "readiness": {
        "probe": "catalog.required-data",
        "required_data": [
          "knowledge-engine-runtime"
        ]
      }
    },
    {
      "capability": "products.provider-linked-document-acquisition-acquisition",
      "version": "1.0.0",
      "input_contract": {
        "name": "noesis-mcp-tool-io-v1",
        "version": "1.0.0"
      },
      "output_contract": {
        "name": "noesis-mcp-tool-io-v1",
        "version": "1.0.0"
      },
      "semantics": {
        "io": "catalog-declared-tool-schemas",
        "declared_as": "provider-linked-document-acquisition"
      },
      "effect": "acquisition",
      "idempotent": false,
      "execution_receipt": false,
      "required_scopes": [
        "knowledge:products:write"
      ],
      "required_context": [
        "namespace",
        "principal"
      ],
      "record_kinds": [],
      "bindings": [
        {
          "kind": "mcp-tool",
          "id": "noesis-knowledge-engine.acquire_product_documents"
        }
      ],
      "readiness": {
        "probe": "catalog.required-data",
        "required_data": [
          "knowledge-engine-runtime"
        ]
      }
    },
    {
      "capability": "products.provider-scoped-product-identities",
      "version": "1.0.0",
      "input_contract": {
        "name": "noesis-mcp-tool-io-v1",
        "version": "1.0.0"
      },
      "output_contract": {
        "name": "noesis-mcp-tool-io-v1",
        "version": "1.0.0"
      },
      "semantics": {
        "io": "catalog-declared-tool-schemas",
        "declared_as": "provider-scoped-product-identities"
      },
      "effect": "read-only",
      "idempotent": true,
      "execution_receipt": false,
      "required_scopes": [
        "knowledge:products:read"
      ],
      "required_context": [
        "namespace",
        "principal"
      ],
      "record_kinds": [],
      "bindings": [
        {
          "kind": "mcp-tool",
          "id": "noesis-knowledge-engine.inspect_product_identity"
        },
        {
          "kind": "mcp-tool",
          "id": "noesis-knowledge-engine.lookup_product_models"
        },
        {
          "kind": "mcp-tool",
          "id": "noesis-knowledge-engine.product_selection_outcomes"
        }
      ],
      "readiness": {
        "probe": "catalog.required-data",
        "required_data": [
          "knowledge-engine-runtime"
        ]
      }
    },
    {
      "capability": "products.reviewable-cross-provider-matching-changes",
      "version": "1.0.0",
      "input_contract": {
        "name": "noesis-mcp-tool-io-v1",
        "version": "1.0.0"
      },
      "output_contract": {
        "name": "noesis-mcp-tool-io-v1",
        "version": "1.0.0"
      },
      "semantics": {
        "io": "catalog-declared-tool-schemas",
        "declared_as": "reviewable-cross-provider-matching"
      },
      "effect": "local-mutation",
      "idempotent": false,
      "execution_receipt": false,
      "required_scopes": [
        "knowledge:products:review",
        "knowledge:products:write"
      ],
      "required_context": [
        "namespace",
        "principal"
      ],
      "record_kinds": [],
      "bindings": [
        {
          "kind": "mcp-tool",
          "id": "noesis-knowledge-engine.propose_product_matches"
        },
        {
          "kind": "mcp-tool",
          "id": "noesis-knowledge-engine.review_product_match"
        }
      ],
      "readiness": {
        "probe": "catalog.required-data",
        "required_data": [
          "knowledge-engine-runtime"
        ]
      }
    },
    {
      "capability": "products.unit-normalized-display-attributes",
      "version": "1.0.0",
      "input_contract": {
        "name": "noesis-mcp-tool-io-v1",
        "version": "1.0.0"
      },
      "output_contract": {
        "name": "noesis-mcp-tool-io-v1",
        "version": "1.0.0"
      },
      "semantics": {
        "io": "catalog-declared-tool-schemas",
        "declared_as": "unit-normalized-display-attributes"
      },
      "effect": "read-only",
      "idempotent": true,
      "execution_receipt": false,
      "required_scopes": [
        "knowledge:products:read"
      ],
      "required_context": [
        "namespace",
        "principal"
      ],
      "record_kinds": [],
      "bindings": [
        {
          "kind": "mcp-tool",
          "id": "noesis-knowledge-engine.compare_product_models"
        },
        {
          "kind": "mcp-tool",
          "id": "noesis-knowledge-engine.inspect_product_identity"
        }
      ],
      "readiness": {
        "probe": "catalog.required-data",
        "required_data": [
          "knowledge-engine-runtime"
        ]
      }
    }
  ],
  "stores": [
    {
      "record_kind": "product_record",
      "tables": [
        "product_assertions",
        "product_coverage",
        "product_current",
        "product_document_assets",
        "product_document_fetches",
        "product_document_links",
        "product_identities",
        "product_identity_conflicts",
        "product_match_reviews",
        "product_matches",
        "product_refresh",
        "product_refresh_history",
        "product_revision_observations",
        "product_revisions"
      ],
      "revision_addressing": "immutable"
    }
  ],
  "source_packs": [
    {
      "pack_id": "products-displays",
      "range": "^1.0.0",
      "config": "config/source_packs/products.json"
    }
  ]
}
