{
  "contract": "noesis-capability-provider-v1",
  "provider_id": "noesis.subscriptions",
  "version": "1.0.0",
  "description": "Generated by src/composition/bundles.py from the verified capability map; owns src.kb.subscriptions records.",
  "implementation": {
    "identity": "src.kb.subscriptions",
    "version": "1.0.0"
  },
  "capabilities": [
    {
      "capability": "subscriptions.events",
      "version": "1.0.0",
      "input_contract": {
        "name": "noesis-mcp-tool-io-v1",
        "version": "1.0.0"
      },
      "output_contract": {
        "name": "noesis-mcp-tool-io-v1",
        "version": "1.0.0"
      },
      "semantics": {
        "io": "catalog-declared-tool-schemas"
      },
      "effect": "read-only",
      "idempotent": true,
      "execution_receipt": false,
      "required_scopes": [
        "knowledge:subscriptions:deliver",
        "knowledge:subscriptions:read"
      ],
      "required_context": [
        "namespace",
        "principal"
      ],
      "record_kinds": [],
      "bindings": [
        {
          "kind": "mcp-tool",
          "id": "noesis-subscriptions.inspect_subscription"
        },
        {
          "kind": "mcp-tool",
          "id": "noesis-subscriptions.pending_subscription_deliveries"
        },
        {
          "kind": "mcp-tool",
          "id": "noesis-subscriptions.poll_subscription"
        }
      ],
      "readiness": {
        "probe": "catalog.required-data",
        "required_data": [
          "knowledge-subscription-store"
        ]
      }
    },
    {
      "capability": "subscriptions.events-changes",
      "version": "1.0.0",
      "input_contract": {
        "name": "noesis-mcp-tool-io-v1",
        "version": "1.0.0"
      },
      "output_contract": {
        "name": "noesis-mcp-tool-io-v1",
        "version": "1.0.0"
      },
      "semantics": {
        "io": "catalog-declared-tool-schemas"
      },
      "effect": "local-mutation",
      "idempotent": false,
      "execution_receipt": false,
      "required_scopes": [
        "knowledge:subscriptions:write"
      ],
      "required_context": [
        "namespace",
        "principal"
      ],
      "record_kinds": [],
      "bindings": [
        {
          "kind": "mcp-tool",
          "id": "noesis-subscriptions.create_subscription"
        }
      ],
      "readiness": {
        "probe": "catalog.required-data",
        "required_data": [
          "knowledge-subscription-store"
        ]
      }
    }
  ],
  "stores": [
    {
      "record_kind": "knowledge_subscription",
      "tables": [
        "knowledge_subscription_access",
        "knowledge_subscription_audit",
        "knowledge_subscription_events",
        "knowledge_subscription_idempotency",
        "knowledge_subscription_outbox",
        "knowledge_subscription_snapshots",
        "knowledge_subscription_watermarks",
        "knowledge_subscriptions"
      ],
      "revision_addressing": "immutable"
    }
  ]
}
