{
  "contract": "noesis-capability-provider-v1",
  "provider_id": "noesis.reports",
  "version": "1.0.0",
  "description": "Generated by src/composition/bundles.py from the verified capability map; owns src.kb.authored_reports records.",
  "implementation": {
    "identity": "src.kb.authored_reports",
    "version": "1.0.0"
  },
  "capabilities": [
    {
      "capability": "reports.authored",
      "version": "1.0.0",
      "input_contract": {
        "name": "noesis-mcp-tool-io-v1",
        "version": "1.0.0"
      },
      "output_contract": {
        "name": "noesis-mcp-tool-io-v1",
        "version": "1.0.0"
      },
      "semantics": {
        "io": "catalog-declared-tool-schemas"
      },
      "effect": "read-only",
      "idempotent": true,
      "execution_receipt": false,
      "required_scopes": [
        "knowledge:reports:read"
      ],
      "required_context": [
        "namespace",
        "principal"
      ],
      "record_kinds": [],
      "bindings": [
        {
          "kind": "mcp-tool",
          "id": "noesis-knowledge-engine.export_authored_report"
        },
        {
          "kind": "mcp-tool",
          "id": "noesis-knowledge-engine.inspect_authored_report"
        }
      ],
      "readiness": {
        "probe": "catalog.required-data",
        "required_data": [
          "knowledge-engine-runtime"
        ]
      }
    },
    {
      "capability": "reports.authored-changes",
      "version": "1.0.0",
      "input_contract": {
        "name": "noesis-mcp-tool-io-v1",
        "version": "1.0.0"
      },
      "output_contract": {
        "name": "noesis-mcp-tool-io-v1",
        "version": "1.0.0"
      },
      "semantics": {
        "io": "catalog-declared-tool-schemas"
      },
      "effect": "local-mutation",
      "idempotent": false,
      "execution_receipt": false,
      "required_scopes": [
        "knowledge:reports:write"
      ],
      "required_context": [
        "namespace",
        "principal"
      ],
      "record_kinds": [],
      "bindings": [
        {
          "kind": "mcp-tool",
          "id": "noesis-knowledge-engine.create_authored_report"
        },
        {
          "kind": "mcp-tool",
          "id": "noesis-knowledge-engine.revise_authored_report"
        }
      ],
      "readiness": {
        "probe": "catalog.required-data",
        "required_data": [
          "knowledge-engine-runtime"
        ]
      }
    }
  ],
  "stores": [
    {
      "record_kind": "authored_report",
      "tables": [
        "authored_report_revisions",
        "authored_reports"
      ],
      "revision_addressing": "immutable"
    }
  ]
}
