{
  "contract": "noesis-capability-provider-v1",
  "provider_id": "noesis.patents",
  "version": "1.0.0",
  "description": "Generated by src/composition/bundles.py from the verified capability map; owns src.kb.patents records.",
  "implementation": {
    "identity": "src.kb.patents",
    "version": "1.0.0"
  },
  "capabilities": [
    {
      "capability": "patents.publications",
      "version": "1.0.0",
      "input_contract": {
        "name": "noesis-mcp-tool-io-v1",
        "version": "1.0.0"
      },
      "output_contract": {
        "name": "noesis-mcp-tool-io-v1",
        "version": "1.0.0"
      },
      "semantics": {
        "io": "catalog-declared-tool-schemas"
      },
      "effect": "read-only",
      "idempotent": true,
      "execution_receipt": false,
      "required_scopes": [
        "knowledge:patents:read"
      ],
      "required_context": [
        "namespace",
        "principal"
      ],
      "record_kinds": [],
      "bindings": [
        {
          "kind": "mcp-tool",
          "id": "noesis-knowledge-engine.inspect_patent_publication"
        },
        {
          "kind": "mcp-tool",
          "id": "noesis-knowledge-engine.patent_family_members"
        },
        {
          "kind": "mcp-tool",
          "id": "noesis-knowledge-engine.patent_links"
        },
        {
          "kind": "mcp-tool",
          "id": "noesis-knowledge-engine.patent_source_contracts"
        }
      ],
      "readiness": {
        "probe": "catalog.required-data",
        "required_data": [
          "knowledge-engine-runtime"
        ]
      }
    },
    {
      "capability": "patents.publications-changes",
      "version": "1.0.0",
      "input_contract": {
        "name": "noesis-mcp-tool-io-v1",
        "version": "1.0.0"
      },
      "output_contract": {
        "name": "noesis-mcp-tool-io-v1",
        "version": "1.0.0"
      },
      "semantics": {
        "io": "catalog-declared-tool-schemas"
      },
      "effect": "local-mutation",
      "idempotent": false,
      "execution_receipt": false,
      "required_scopes": [
        "knowledge:patents:review",
        "knowledge:patents:write"
      ],
      "required_context": [
        "namespace",
        "principal"
      ],
      "record_kinds": [],
      "bindings": [
        {
          "kind": "mcp-tool",
          "id": "noesis-knowledge-engine.propose_patent_link"
        },
        {
          "kind": "mcp-tool",
          "id": "noesis-knowledge-engine.review_patent_link"
        }
      ],
      "readiness": {
        "probe": "catalog.required-data",
        "required_data": [
          "knowledge-engine-runtime"
        ]
      }
    }
  ],
  "stores": [
    {
      "record_kind": "patent_record",
      "tables": [
        "patent_links",
        "patent_part_current",
        "patent_part_revisions",
        "patent_publications"
      ],
      "revision_addressing": "immutable"
    }
  ],
  "source_packs": [
    {
      "pack_id": "research-discovery",
      "range": "^1.0.0",
      "config": "config/source_packs/research.json"
    }
  ]
}
